{
  "schema_version": "jules-controller.plan.v1",
  "plan_id": "plan-read-only-example",
  "plan_hash": "sha256:c8d5067a0f5ce593a8b16bfc0c7306e911d376f5b4ce001030fe35b0c57eab73",
  "profile": "default",
  "execution": {
    "mode": "read_only"
  },
  "scope": {
    "repository": "OWNER/REPO",
    "branch": "feature/example",
    "sessions": [
      "sessions/EXAMPLE"
    ]
  },
  "limits": {
    "deadline_seconds": 180,
    "request_timeout_seconds": 20,
    "max_http_requests": 120,
    "max_posts": 0,
    "max_pages": 100,
    "max_sessions": 200,
    "max_response_bytes": 8388608,
    "max_total_bytes": 33554432,
    "max_output_bytes": 65536
  },
  "actions": [
    {
      "id": "act-inventory",
      "op": "inventory.collect",
      "params": {
        "scope": "all"
      }
    },
    {
      "id": "act-chats",
      "op": "chats.collect",
      "params": {
        "session": {
          "from": "act-inventory",
          "select": "active_session"
        }
      }
    }
  ],
  "output": {
    "format": "json"
  }
}
