{
  "schema_version": "jules-controller.plan.v1",
  "plan_id": "template-reply-disabled",
  "plan_hash": "sha256:835ce64c740d9d72632766e63ee460932311013227124aaa8c4215f7da4e25fe",
  "profile": "default",
  "execution": {
    "mode": "mutation"
  },
  "scope": {
    "repository": "OWNER/REPO",
    "branch": "feature/example",
    "sessions": [
      "sessions/EXAMPLE"
    ]
  },
  "limits": {
    "deadline_seconds": 180,
    "request_timeout_seconds": 20,
    "max_http_requests": 120,
    "max_posts": 1,
    "max_pages": 100,
    "max_sessions": 200,
    "max_response_bytes": 8388608,
    "max_total_bytes": 33554432,
    "max_output_bytes": 65536
  },
  "actions": [
    {
      "id": "act-reply",
      "op": "chats.reply",
      "enabled": false,
      "operation_id": "op-reply-example",
      "authorization_ref": "<UNISSUED_AUTH_REF>",
      "target": "sessions/EXAMPLE",
      "payload": {
        "text": "<APPROVED_TEXT>"
      },
      "preconditions": {}
    }
  ],
  "output": {
    "format": "json"
  }
}
