{
  "schema_version": "jules-controller.plan.v1",
  "plan_id": "template-create-disabled",
  "plan_hash": "sha256:451edda863759ddc8f87d9e21708ae54d8ed18cd3f6309c10c12c4520f25074b",
  "profile": "default",
  "execution": {
    "mode": "mutation"
  },
  "scope": {
    "repository": "OWNER/REPO",
    "branch": "feature/example"
  },
  "limits": {
    "deadline_seconds": 180,
    "request_timeout_seconds": 20,
    "max_http_requests": 120,
    "max_posts": 1,
    "max_pages": 100,
    "max_sessions": 200,
    "max_response_bytes": 8388608,
    "max_total_bytes": 33554432,
    "max_output_bytes": 65536
  },
  "actions": [
    {
      "id": "act-create",
      "op": "tasks.create",
      "enabled": false,
      "operation_id": "op-create-example",
      "authorization_ref": "<UNISSUED_AUTH_REF>",
      "target": "OWNER/REPO",
      "payload": {
        "title": "Example Task",
        "prompt": "<APPROVED_TASK_PROMPT>",
        "requirePlanApproval": true
      },
      "preconditions": {}
    }
  ],
  "output": {
    "format": "json"
  }
}
