{
  "schema_version": "jules-controller.plan.v1",
  "plan_id": "template-approve-disabled",
  "plan_hash": "sha256:05670ee312b9c4dfd5b6e7215d71c42b19d845b732ecae682135d57bd04213fd",
  "profile": "default",
  "execution": {
    "mode": "mutation"
  },
  "scope": {
    "repository": "OWNER/REPO",
    "branch": "feature/example",
    "sessions": [
      "sessions/EXAMPLE"
    ]
  },
  "limits": {
    "deadline_seconds": 180,
    "request_timeout_seconds": 20,
    "max_http_requests": 120,
    "max_posts": 1,
    "max_pages": 100,
    "max_sessions": 200,
    "max_response_bytes": 8388608,
    "max_total_bytes": 33554432,
    "max_output_bytes": 65536
  },
  "actions": [
    {
      "id": "act-approve",
      "op": "plans.approve",
      "enabled": false,
      "operation_id": "op-approve-example",
      "authorization_ref": "<UNISSUED_AUTH_REF>",
      "target": "sessions/EXAMPLE",
      "payload": {
        "plan_id": "<APPROVED_PLAN_ID>"
      },
      "preconditions": {}
    }
  ],
  "output": {
    "format": "json"
  }
}
